{
  "id": "io.spine-workshop.codex",
  "name": "Codex 信息",
  "author": "xjunrao-ux",
  "description": "外置 ZIP 插件：显示本机 Codex 额度、重置时间与可读取的任务状态。",
  "version": "1.1.0",
  "apiVersion": 1,
  "minHostVersion": "3.2.3",
  "category": "开发工具",
  "sourceUrl": "https://github.com/xjunrao-ux/spine-pet-workshop/tree/v5.2.2/examples/codex-plugin",
  "downloadUrl": "https://github.com/xjunrao-ux/spine-pet-workshop/releases/download/v5.2.2/Codex-Plugin-v1.1.0.zip",
  "sha256": "16a31c707af618a2d3db17592fdfd350a8753fb06efd8ef2bd270cb9e736d3e3",
  "permissions": [
    "codex.read",
    "ui.reminders"
  ],
  "license": "UNLICENSED"
}
