{
  "id": "local.spine-weather",
  "name": "天气与预报",
  "author": "xjunrao-ux",
  "description": "选择城市，查看当前天气、未来 24 小时和 7 天天气预报。数据由 Open-Meteo 提供。",
  "version": "1.2.0",
  "apiVersion": 1,
  "minHostVersion": "5.1.2",
  "category": "天气",
  "sourceUrl": "https://github.com/xjunrao-ux/spine-pet-workshop/tree/v5.2.1/examples/weather-plugin",
  "downloadUrl": "https://github.com/xjunrao-ux/spine-pet-workshop/releases/download/v5.2.1/Weather-Plugin-v1.2.0.zip",
  "sha256": "a6436b914b16f7d24f422a75b12c8087f80b44d001204275acc3ccb8f00ff068",
  "permissions": [
    "storage.own",
    "weather.read"
  ],
  "license": "UNLICENSED"
}
