{
  "id": "com.example.hello-counter",
  "name": "我的第一个插件",
  "author": "xjunrao-ux",
  "description": "入门 demo：点击加一或清零，不联网、不保存数据。",
  "version": "1.0.0",
  "apiVersion": 1,
  "minHostVersion": "3.2.3",
  "category": "学习示例",
  "sourceUrl": "https://github.com/xjunrao-ux/spine-pet-workshop/tree/v5.1.3/examples/hello-counter-plugin",
  "downloadUrl": "https://github.com/xjunrao-ux/spine-pet-workshop/releases/download/v5.1.3/Hello-Counter-v1.0.0.zip",
  "sha256": "7138b294203e67944d0d039f69b76fb23bb922030beafd9e65946358c04f4d49",
  "permissions": [],
  "license": "MIT"
}
